[
  {
    "schema_version": "dawloop-reference-v1",
    "source_id": "sample-a",
    "source_label": "Synthetic exercise",
    "reference_group": "generic-learning",
    "independent_work_id": "sample-a",
    "material_kind": "synthetic",
    "local_ref": "references/sample-a.json",
    "content_hash": "39ed4ecf63eca41a13f03590529c6a83afd2dab1f60025b0bfdd9653e868fb91",
    "rights_status": "owned",
    "rights_note": "Synthetic notes supplied with this MIT example"
  },
  {
    "schema_version": "dawloop-reference-v1",
    "source_id": "sample-b",
    "source_label": "Synthetic exercise",
    "reference_group": "generic-learning",
    "independent_work_id": "sample-b",
    "material_kind": "synthetic",
    "local_ref": "references/sample-b.json",
    "content_hash": "2bfda36e5266c5f027eb49bcc2f7589ca6afeb8278c1207b4e5b8665941b1743",
    "rights_status": "owned",
    "rights_note": "Synthetic notes supplied with this MIT example"
  },
  {
    "schema_version": "dawloop-reference-v1",
    "source_id": "sample-holdout",
    "source_label": "Synthetic exercise",
    "reference_group": "generic-learning",
    "independent_work_id": "sample-holdout",
    "material_kind": "synthetic",
    "local_ref": "references/sample-holdout.json",
    "content_hash": "b488ac0def9e8b786efc06cc223feb9802e771e3913c8609b7714d5b3ba07632",
    "rights_status": "owned",
    "rights_note": "Synthetic notes supplied with this MIT example"
  }
]
